<?xml version="1.0" encoding="UTF-8"?>
<tns:patient xmlns:tns="http://www.example.org/Patient" xmlns:xsi="http://www.w3.org/2001/XMLSchema-instance" xsi:schemaLocation="http://www.example.org/Patient Patient.xsd ">
  <tns:name>tns:name</tns:name>
  <tns:DOB>2001-01-01</tns:DOB>
  <tns:email>tns:email</tns:email>
  <tns:gender>M</tns:gender>
  <tns:phone>tns:phone</tns:phone>
  <tns:paymentType>
    <tns:cash>0</tns:cash>
  </tns:paymentType>
</tns:patient>
